{
  "capabilityId": "full_stack_engineer",
  "version": "1.0.0",
  "categories": [
    {
      "name": "Explainability",
      "tests": [
        {
          "id": "full_stack_engineer-explainability-001",
          "description": "Golden test for explainability in full_stack_engineer",
          "input": {
            "capability_id": "full_stack_engineer",
            "category": "explainability"
          },
          "expected": {
            "status": "success"
          },
          "tolerance": 0.01
        }
      ]
    }
  ],
  "generatedAt": "2026-08-05T00:00:00Z"
}